{
  "schema_version": "0.1",
  "source_visual_score": "data/music/graceful_opening.visual_score_v0_1.json",
  "source_geometry_plan": "data/geometry/graceful_opening_00_140.geometry_plan_v0_1.json",
  "time_range": {
    "start": 120.0,
    "end": 140.016
  },
  "world_range": {
    "start_x": 480.0,
    "end_x": 560.064
  },
  "policy": {
    "type": "passive_spatial_expression_over_existing_runways",
    "event_geometry_preserved": true,
    "new_required_actions": false,
    "new_gaps": false,
    "max_passive_delta_y": 0.15,
    "max_adjacent_passive_step": 0.3,
    "controller_max_traversable_step_height": 0.45,
    "reaction_lead_seconds": 0.75,
    "geometry_lock_actions": [
      "HOLD",
      "JUMP",
      "SWIPE_DOWN"
    ],
    "beat_subdivision": true
  },
  "action_locks": [
    {
      "time": 128.0,
      "action": "JUMP",
      "start_time": 127.25,
      "end_time": 128.9167,
      "start_x": 509.0,
      "end_x": 515.6668
    }
  ],
  "segments": [
    {
      "start_x": 480.0,
      "end_x": 480.42,
      "length": 0.42,
      "base_surface_y": -2.8,
      "surface_y": -2.8374,
      "delta_y": -0.0374,
      "pattern": "PULSE_STEPS",
      "source_window_index": 64,
      "source_phase_index": 1,
      "source_phase_count": 4,
      "source_time": {
        "start": 120.0,
        "end": 120.105
      },
      "musical_intent": {
        "phrase_role": "PULSE",
        "articulation": "ACCENTED",
        "contour": "LEVEL",
        "intensity": 0.5684,
        "continuity": 0.3813,
        "lift": 0.2106
      },
      "interaction_lock": null
    },
    {
      "start_x": 480.42,
      "end_x": 482.278,
      "length": 1.858,
      "base_surface_y": -2.8,
      "surface_y": -2.7252,
      "delta_y": 0.0748,
      "pattern": "PULSE_STEPS",
      "source_window_index": 64,
      "source_phase_index": 2,
      "source_phase_count": 4,
      "source_time": {
        "start": 120.105,
        "end": 120.5695
      },
      "musical_intent": {
        "phrase_role": "PULSE",
        "articulation": "ACCENTED",
        "contour": "LEVEL",
        "intensity": 0.5684,
        "continuity": 0.3813,
        "lift": 0.2106
      },
      "interaction_lock": null
    },
    {
      "start_x": 482.278,
      "end_x": 484.136,
      "length": 1.858,
      "base_surface_y": -2.8,
      "surface_y": -2.8374,
      "delta_y": -0.0374,
      "pattern": "PULSE_STEPS",
      "source_window_index": 64,
      "source_phase_index": 3,
      "source_phase_count": 4,
      "source_time": {
        "start": 120.5695,
        "end": 121.034
      },
      "musical_intent": {
        "phrase_role": "PULSE",
        "articulation": "ACCENTED",
        "contour": "LEVEL",
        "intensity": 0.5684,
        "continuity": 0.3813,
        "lift": 0.2106
      },
      "interaction_lock": null
    },
    {
      "start_x": 484.136,
      "end_x": 485.993,
      "length": 1.857,
      "base_surface_y": -2.8,
      "surface_y": -2.7686,
      "delta_y": 0.0314,
      "pattern": "LIFTED_TERRACE",
      "source_window_index": 65,
      "source_phase_index": 0,
      "source_phase_count": 4,
      "source_time": {
        "start": 121.034,
        "end": 121.4983
      },
      "musical_intent": {
        "phrase_role": "CLIMAX",
        "articulation": "ACCENTED",
        "contour": "LEVEL",
        "intensity": 0.7572,
        "continuity": 0.2753,
        "lift": 0.6071
      },
      "interaction_lock": null
    },
    {
      "start_x": 485.993,
      "end_x": 487.85,
      "length": 1.857,
      "base_surface_y": -2.8,
      "surface_y": -2.7162,
      "delta_y": 0.0838,
      "pattern": "LIFTED_TERRACE",
      "source_window_index": 65,
      "source_phase_index": 1,
      "source_phase_count": 4,
      "source_time": {
        "start": 121.4983,
        "end": 121.9625
      },
      "musical_intent": {
        "phrase_role": "CLIMAX",
        "articulation": "ACCENTED",
        "contour": "LEVEL",
        "intensity": 0.7572,
        "continuity": 0.2753,
        "lift": 0.6071
      },
      "interaction_lock": null
    },
    {
      "start_x": 487.85,
      "end_x": 489.707,
      "length": 1.857,
      "base_surface_y": -2.8,
      "surface_y": -2.6848,
      "delta_y": 0.1152,
      "pattern": "LIFTED_TERRACE",
      "source_window_index": 65,
      "source_phase_index": 2,
      "source_phase_count": 4,
      "source_time": {
        "start": 121.9625,
        "end": 122.4267
      },
      "musical_intent": {
        "phrase_role": "CLIMAX",
        "articulation": "ACCENTED",
        "contour": "LEVEL",
        "intensity": 0.7572,
        "continuity": 0.2753,
        "lift": 0.6071
      },
      "interaction_lock": null
    },
    {
      "start_x": 489.707,
      "end_x": 491.564,
      "length": 1.857,
      "base_surface_y": -2.8,
      "surface_y": -2.7371,
      "delta_y": 0.0629,
      "pattern": "LIFTED_TERRACE",
      "source_window_index": 65,
      "source_phase_index": 3,
      "source_phase_count": 4,
      "source_time": {
        "start": 122.4267,
        "end": 122.891
      },
      "musical_intent": {
        "phrase_role": "CLIMAX",
        "articulation": "ACCENTED",
        "contour": "LEVEL",
        "intensity": 0.7572,
        "continuity": 0.2753,
        "lift": 0.6071
      },
      "interaction_lock": null
    },
    {
      "start_x": 491.564,
      "end_x": 493.422,
      "length": 1.858,
      "base_surface_y": -2.8,
      "surface_y": -2.7777,
      "delta_y": 0.0223,
      "pattern": "FLOWING_SPAN",
      "source_window_index": 66,
      "source_phase_index": 0,
      "source_phase_count": 4,
      "source_time": {
        "start": 122.891,
        "end": 123.3555
      },
      "musical_intent": {
        "phrase_role": "FLOW",
        "articulation": "MIXED",
        "contour": "LEVEL",
        "intensity": 0.5509,
        "continuity": 0.4563,
        "lift": 0.1865
      },
      "interaction_lock": null
    },
    {
      "start_x": 493.422,
      "end_x": 495.28,
      "length": 1.858,
      "base_surface_y": -2.8,
      "surface_y": -2.7777,
      "delta_y": 0.0223,
      "pattern": "FLOWING_SPAN",
      "source_window_index": 66,
      "source_phase_index": 1,
      "source_phase_count": 4,
      "source_time": {
        "start": 123.3555,
        "end": 123.82
      },
      "musical_intent": {
        "phrase_role": "FLOW",
        "articulation": "MIXED",
        "contour": "LEVEL",
        "intensity": 0.5509,
        "continuity": 0.4563,
        "lift": 0.1865
      },
      "interaction_lock": null
    },
    {
      "start_x": 495.28,
      "end_x": 497.138,
      "length": 1.858,
      "base_surface_y": -2.8,
      "surface_y": -2.8223,
      "delta_y": -0.0223,
      "pattern": "FLOWING_SPAN",
      "source_window_index": 66,
      "source_phase_index": 2,
      "source_phase_count": 4,
      "source_time": {
        "start": 123.82,
        "end": 124.2845
      },
      "musical_intent": {
        "phrase_role": "FLOW",
        "articulation": "MIXED",
        "contour": "LEVEL",
        "intensity": 0.5509,
        "continuity": 0.4563,
        "lift": 0.1865
      },
      "interaction_lock": null
    },
    {
      "start_x": 497.138,
      "end_x": 498.996,
      "length": 1.858,
      "base_surface_y": -2.8,
      "surface_y": -2.8223,
      "delta_y": -0.0223,
      "pattern": "FLOWING_SPAN",
      "source_window_index": 66,
      "source_phase_index": 3,
      "source_phase_count": 4,
      "source_time": {
        "start": 124.2845,
        "end": 124.749
      },
      "musical_intent": {
        "phrase_role": "FLOW",
        "articulation": "MIXED",
        "contour": "LEVEL",
        "intensity": 0.5509,
        "continuity": 0.4563,
        "lift": 0.1865
      },
      "interaction_lock": null
    },
    {
      "start_x": 498.996,
      "end_x": 500.854,
      "length": 1.858,
      "base_surface_y": -2.8,
      "surface_y": -2.7776,
      "delta_y": 0.0224,
      "pattern": "FLOWING_SPAN",
      "source_window_index": 67,
      "source_phase_index": 0,
      "source_phase_count": 4,
      "source_time": {
        "start": 124.749,
        "end": 125.2135
      },
      "musical_intent": {
        "phrase_role": "FLOW",
        "articulation": "MIXED",
        "contour": "LEVEL",
        "intensity": 0.5555,
        "continuity": 0.366,
        "lift": 0.1908
      },
      "interaction_lock": null
    },
    {
      "start_x": 500.854,
      "end_x": 502.712,
      "length": 1.858,
      "base_surface_y": -2.8,
      "surface_y": -2.7776,
      "delta_y": 0.0224,
      "pattern": "FLOWING_SPAN",
      "source_window_index": 67,
      "source_phase_index": 1,
      "source_phase_count": 4,
      "source_time": {
        "start": 125.2135,
        "end": 125.678
      },
      "musical_intent": {
        "phrase_role": "FLOW",
        "articulation": "MIXED",
        "contour": "LEVEL",
        "intensity": 0.5555,
        "continuity": 0.366,
        "lift": 0.1908
      },
      "interaction_lock": null
    },
    {
      "start_x": 502.712,
      "end_x": 504.57,
      "length": 1.858,
      "base_surface_y": -2.8,
      "surface_y": -2.8224,
      "delta_y": -0.0224,
      "pattern": "FLOWING_SPAN",
      "source_window_index": 67,
      "source_phase_index": 2,
      "source_phase_count": 4,
      "source_time": {
        "start": 125.678,
        "end": 126.1425
      },
      "musical_intent": {
        "phrase_role": "FLOW",
        "articulation": "MIXED",
        "contour": "LEVEL",
        "intensity": 0.5555,
        "continuity": 0.366,
        "lift": 0.1908
      },
      "interaction_lock": null
    },
    {
      "start_x": 504.57,
      "end_x": 506.428,
      "length": 1.858,
      "base_surface_y": -2.8,
      "surface_y": -2.8224,
      "delta_y": -0.0224,
      "pattern": "FLOWING_SPAN",
      "source_window_index": 67,
      "source_phase_index": 3,
      "source_phase_count": 4,
      "source_time": {